{
  "contract_version": "1.1",
  "case_id": "PCA-20260825-NN0U4DO7",
  "state": "auswertung",
  "created_at": "2026-08-25T16:13:52Z",
  "updated_at": "2026-08-27T08:54:11Z",
  "delivery_document": "customer_check",
  "identity": {
    "status": "resolved",
    "label": "U-Center",
    "confidence": "high"
  },
  "overall_rating": null,
  "checks": [
    {
      "id": 1,
      "key": "title_review_overall",
      "workflow_status": "laeuft",
      "result_status": "eigenaussage",
      "evidence_count": 6,
      "summary": "6 Belege zugeordnet; unabhängige/vertiefende Prüfung steht noch aus.",
      "perspectives": {
        "customer": {
          "status": "laeuft",
          "updated_at": "2026-08-25T16:50:31Z"
        },
        "company": {
          "status": "laeuft",
          "updated_at": "2026-08-25T16:50:31Z"
        },
        "academy": {
          "status": "laeuft",
          "updated_at": "2026-08-25T16:50:31Z"
        }
      },
      "started_at": "2026-08-25T16:30:50Z",
      "finished_at": null
    },
    {
      "id": 2,
      "key": "executive_summary",
      "workflow_status": "wartet",
      "result_status": null,
      "evidence_count": 0,
      "summary": "Weiterer Recherchebaustein erforderlich.",
      "perspectives": {
        "customer": {
          "status": "wartet",
          "updated_at": null
        },
        "company": {
          "status": "wartet",
          "updated_at": null
        },
        "academy": {
          "status": "wartet",
          "updated_at": null
        }
      },
      "started_at": null,
      "finished_at": null
    },
    {
      "id": 3,
      "key": "big_picture",
      "workflow_status": "laeuft",
      "result_status": "eigenaussage",
      "evidence_count": 6,
      "summary": "6 Belege zugeordnet; unabhängige/vertiefende Prüfung steht noch aus.",
      "perspectives": {
        "customer": {
          "status": "laeuft",
          "updated_at": "2026-08-25T16:50:31Z"
        },
        "company": {
          "status": "laeuft",
          "updated_at": "2026-08-25T16:50:31Z"
        },
        "academy": {
          "status": "laeuft",
          "updated_at": "2026-08-25T16:50:31Z"
        }
      },
      "started_at": "2026-08-25T16:30:50Z",
      "finished_at": null
    },
    {
      "id": 4,
      "key": "positive_confirmed_facts",
      "workflow_status": "laeuft",
      "result_status": "eigenaussage",
      "evidence_count": 6,
      "summary": "6 Belege zugeordnet; unabhängige/vertiefende Prüfung steht noch aus.",
      "perspectives": {
        "customer": {
          "status": "laeuft",
          "updated_at": "2026-08-25T16:50:31Z"
        },
        "company": {
          "status": "laeuft",
          "updated_at": "2026-08-25T16:50:31Z"
        },
        "academy": {
          "status": "laeuft",
          "updated_at": "2026-08-25T16:50:31Z"
        }
      },
      "started_at": "2026-08-25T16:30:50Z",
      "finished_at": null
    },
    {
      "id": 5,
      "key": "critical_contradictory_open_facts",
      "workflow_status": "laeuft",
      "result_status": "eigenaussage",
      "evidence_count": 5,
      "summary": "5 Belege zugeordnet; unabhängige/vertiefende Prüfung steht noch aus.",
      "perspectives": {
        "customer": {
          "status": "laeuft",
          "updated_at": "2026-08-25T16:50:31Z"
        },
        "company": {
          "status": "laeuft",
          "updated_at": "2026-08-25T16:50:31Z"
        },
        "academy": {
          "status": "laeuft",
          "updated_at": "2026-08-25T16:50:31Z"
        }
      },
      "started_at": "2026-08-25T16:30:50Z",
      "finished_at": null
    },
    {
      "id": 6,
      "key": "methodology_evidence_standard",
      "workflow_status": "abgeschlossen",
      "result_status": "bestaetigt",
      "evidence_count": 8,
      "summary": "Primärquellen-Auswertung abgeschlossen · 8 Belege · bestaetigt.",
      "perspectives": {
        "customer": {
          "status": "abgeschlossen",
          "updated_at": "2026-08-25T16:50:31Z"
        },
        "company": {
          "status": "abgeschlossen",
          "updated_at": "2026-08-25T16:50:31Z"
        },
        "academy": {
          "status": "abgeschlossen",
          "updated_at": "2026-08-25T16:50:31Z"
        }
      },
      "started_at": "2026-08-25T16:30:50Z",
      "finished_at": "2026-08-25T16:50:31Z"
    },
    {
      "id": 7,
      "key": "product_function",
      "workflow_status": "abgeschlossen",
      "result_status": "eigenaussage",
      "evidence_count": 6,
      "summary": "Primärquellen-Auswertung abgeschlossen · 6 Belege · eigenaussage.",
      "perspectives": {
        "customer": {
          "status": "abgeschlossen",
          "updated_at": "2026-08-25T16:50:31Z"
        },
        "company": {
          "status": "abgeschlossen",
          "updated_at": "2026-08-25T16:50:31Z"
        },
        "academy": {
          "status": "abgeschlossen",
          "updated_at": "2026-08-25T16:50:31Z"
        }
      },
      "started_at": "2026-08-25T16:30:50Z",
      "finished_at": "2026-08-25T16:50:31Z"
    },
    {
      "id": 8,
      "key": "real_problem_utility",
      "workflow_status": "laeuft",
      "result_status": "eigenaussage",
      "evidence_count": 6,
      "summary": "6 Belege zugeordnet; unabhängige/vertiefende Prüfung steht noch aus.",
      "perspectives": {
        "customer": {
          "status": "laeuft",
          "updated_at": "2026-08-25T16:50:31Z"
        },
        "company": {
          "status": "laeuft",
          "updated_at": "2026-08-25T16:50:31Z"
        },
        "academy": {
          "status": "laeuft",
          "updated_at": "2026-08-25T16:50:31Z"
        }
      },
      "started_at": "2026-08-25T16:30:50Z",
      "finished_at": null
    },
    {
      "id": 9,
      "key": "operator_legal_entity",
      "workflow_status": "laeuft",
      "result_status": "eigenaussage",
      "evidence_count": 11,
      "summary": "Amtliche Verifikation über 10 ausgewählte Register-/Aufsichtsquellen durchgeführt; noch kein eindeutig zuordenbarer amtlicher Zielseitenbeleg für diesen Prüfbereich.",
      "perspectives": {
        "customer": {
          "status": "laeuft",
          "updated_at": "2026-08-27T08:54:11Z"
        },
        "company": {
          "status": "laeuft",
          "updated_at": "2026-08-27T08:54:11Z"
        },
        "academy": {
          "status": "laeuft",
          "updated_at": "2026-08-27T08:54:11Z"
        }
      },
      "started_at": "2026-08-25T16:30:50Z",
      "finished_at": null
    },
    {
      "id": 10,
      "key": "persons_control_history",
      "workflow_status": "laeuft",
      "result_status": "eigenaussage",
      "evidence_count": 11,
      "summary": "Amtliche Verifikation über 10 ausgewählte Register-/Aufsichtsquellen durchgeführt; noch kein eindeutig zuordenbarer amtlicher Zielseitenbeleg für diesen Prüfbereich.",
      "perspectives": {
        "customer": {
          "status": "laeuft",
          "updated_at": "2026-08-27T08:54:09Z"
        },
        "company": {
          "status": "laeuft",
          "updated_at": "2026-08-27T08:54:09Z"
        },
        "academy": {
          "status": "laeuft",
          "updated_at": "2026-08-27T08:54:09Z"
        }
      },
      "started_at": "2026-08-25T16:30:50Z",
      "finished_at": null
    },
    {
      "id": 11,
      "key": "regulation_licences_markets",
      "workflow_status": "laeuft",
      "result_status": "eigenaussage",
      "evidence_count": 8,
      "summary": "Amtliche Verifikation über 10 ausgewählte Register-/Aufsichtsquellen durchgeführt; noch kein eindeutig zuordenbarer amtlicher Zielseitenbeleg für diesen Prüfbereich.",
      "perspectives": {
        "customer": {
          "status": "laeuft",
          "updated_at": "2026-08-27T08:54:09Z"
        },
        "company": {
          "status": "laeuft",
          "updated_at": "2026-08-27T08:54:09Z"
        },
        "academy": {
          "status": "laeuft",
          "updated_at": "2026-08-27T08:54:09Z"
        }
      },
      "started_at": "2026-08-25T16:30:50Z",
      "finished_at": null
    },
    {
      "id": 12,
      "key": "money_flow_custody_claim",
      "workflow_status": "laeuft",
      "result_status": "eigenaussage",
      "evidence_count": 6,
      "summary": "6 Belege zugeordnet; unabhängige/vertiefende Prüfung steht noch aus.",
      "perspectives": {
        "customer": {
          "status": "laeuft",
          "updated_at": "2026-08-25T16:50:31Z"
        },
        "company": {
          "status": "laeuft",
          "updated_at": "2026-08-25T16:50:31Z"
        },
        "academy": {
          "status": "laeuft",
          "updated_at": "2026-08-25T16:50:31Z"
        }
      },
      "started_at": "2026-08-25T16:30:50Z",
      "finished_at": null
    },
    {
      "id": 13,
      "key": "costs_fees_pricing",
      "workflow_status": "abgeschlossen",
      "result_status": "eigenaussage",
      "evidence_count": 6,
      "summary": "Primärquellen-Auswertung abgeschlossen · 6 Belege · eigenaussage.",
      "perspectives": {
        "customer": {
          "status": "abgeschlossen",
          "updated_at": "2026-08-25T16:50:31Z"
        },
        "company": {
          "status": "abgeschlossen",
          "updated_at": "2026-08-25T16:50:31Z"
        },
        "academy": {
          "status": "abgeschlossen",
          "updated_at": "2026-08-25T16:50:31Z"
        }
      },
      "started_at": "2026-08-25T16:30:50Z",
      "finished_at": "2026-08-25T16:50:31Z"
    },
    {
      "id": 14,
      "key": "returns_performance_promise",
      "workflow_status": "abgeschlossen",
      "result_status": "eigenaussage",
      "evidence_count": 6,
      "summary": "Primärquellen-Auswertung abgeschlossen · 6 Belege · eigenaussage.",
      "perspectives": {
        "customer": {
          "status": "abgeschlossen",
          "updated_at": "2026-08-25T16:50:31Z"
        },